{
  "schema": "ingen.ci-result/v1",
  "tool": "paddock",
  "kind": "architecture",
  "status": "failed",
  "exit_code": 1,
  "created_at": "2026-09-15T12:00:00Z",
  "source": {
    "root": "fixtures/document-pipeline"
  },
  "report": {
    "schema": "test.paddock-report/v1",
    "violations": [
      {
        "rule": "example-boundary",
        "from": "app.domain",
        "to": "app.adapters"
      }
    ]
  },
  "explanation": {
    "schema": "test.paddock-explanation/v1",
    "summary": "architecture rule violated"
  }
}
